{"schema_version":"1.5","id":"niger-601-64-retail-kg","country":{"id":"niger","name":"Niger"},"market":{"id":601,"name":"Mangaize","admin1":"Tillaberi","admin2":"Ouallam","latitude":14.68,"longitude":1.95},"commodity":{"id":64,"name":"Rice (imported)","name_fr":"Riz (importé)","group":"rice"},"unit":"KG","currency":"XOF","price_type":"retail","eligible":true,"status":{"code":"normal","level_vs_usual_pct":-16,"month":"2026-08"},"explanation":{"en":"In August 2026 the price was 16% below the usual level for that time of year (normal). It fell 2% over the 3 months before. For rice, across 59 markets in Niger, the median price was about stable. November 2026: most likely between 487 and 629 XOF/KG (8 in 10 chance). January 2027: most likely between 461 and 650 XOF/KG (8 in 10 chance). Chance of a spike in November 2026 (price well above the usual level for the season): 1%. Warnings of new spikes have no proven skill yet (track record 2023-2026).","fr":"En août 2026, le prix était 16 % en dessous du niveau habituel pour cette période de l'année (normal). Il avait baissé de 2 % au cours des 3 mois précédents. Pour le riz, sur 59 marchés au Niger, le prix médian est resté à peu près stable. Novembre 2026 : probablement entre 487 et 629 XOF/KG (8 chances sur 10). Janvier 2027 : probablement entre 461 et 650 XOF/KG (8 chances sur 10). Probabilité d'une flambée des prix en novembre 2026 (prix nettement au-dessus du niveau habituel pour la saison) : 1 %. Les alertes de nouvelles flambées des prix n'ont pas encore fait leurs preuves (historique 2023-2026)."},"reporting":{"months_reported_12":12,"irregular":false},"signals":{"national_gap":{"month":"2026-08","pct":16,"usual_pct":12,"n_markets":52,"far_above_usual":false},"silence":null,"text":{"en":"In August 2026 the price here was 16% above the national median of 52 markets (usually 12% above).","fr":"En août 2026, le prix ici était 16 % au-dessus de la médiane nationale de 52 marchés (d'habitude 12 % au-dessus)."}},"dates":{"forecast_origin":"2026-10","data_up_to":"2026-08","model_version":"2","last_observed_month":"2026-08","run_at":"2026-10-27T19:15:26.474667"},"history":[{"month":"2009-01","price":478.0,"flag":null},{"month":"2009-02","price":478.0,"flag":null},{"month":"2009-03","price":442.0,"flag":null},{"month":"2009-04","price":439.0,"flag":null},{"month":"2009-05","price":486.11,"flag":null},{"month":"2009-06","price":479.45,"flag":null},{"month":"2009-07","price":445.21,"flag":null},{"month":"2009-08","price":434.03,"flag":null},{"month":"2009-09","price":478.0,"flag":null},{"month":"2009-10","price":480.8,"flag":null},{"month":"2009-11","price":445.67,"flag":null},{"month":"2009-12","price":448.0,"flag":null},{"month":"2010-01","price":448.0,"flag":null},{"month":"2010-03","price":448.0,"flag":null},{"month":"2010-04","price":441.18,"flag":null},{"month":"2010-05","price":441.18,"flag":null},{"month":"2010-06","price":441.18,"flag":null},{"month":"2010-07","price":447.76,"flag":null},{"month":"2010-08","price":447.76,"flag":null},{"month":"2010-09","price":447.76,"flag":null},{"month":"2010-10","price":448.0,"flag":null},{"month":"2010-11","price":423.08,"flag":null},{"month":"2010-12","price":485.0,"flag":null},{"month":"2011-01","price":490.2,"flag":null},{"month":"2011-03","price":478.0,"flag":null},{"month":"2011-05","price":493.0,"flag":null},{"month":"2011-06","price":486.0,"flag":null},{"month":"2011-07","price":522.0,"flag":null},{"month":"2011-11","price":522.0,"flag":null},{"month":"2011-12","price":478.0,"flag":null},{"month":"2012-04","price":485.0,"flag":null},{"month":"2012-05","price":479.0,"flag":null},{"month":"2012-07","price":486.0,"flag":null},{"month":"2012-08","price":474.5,"flag":null},{"month":"2012-10","price":544.85,"flag":null},{"month":"2012-11","price":477.94,"flag":null},{"month":"2012-12","price":441.0,"flag":null},{"month":"2013-01","price":441.0,"flag":null},{"month":"2013-03","price":441.0,"flag":null},{"month":"2013-04","price":441.0,"flag":null},{"month":"2013-05","price":441.0,"flag":null},{"month":"2013-07","price":444.5,"flag":null},{"month":"2013-08","price":441.0,"flag":null},{"month":"2013-11","price":448.0,"flag":null},{"month":"2013-12","price":461.54,"flag":null},{"month":"2014-01","price":461.54,"flag":null},{"month":"2014-02","price":452.35,"flag":null},{"month":"2014-03","price":447.76,"flag":null},{"month":"2014-04","price":447.76,"flag":null},{"month":"2014-05","price":447.76,"flag":null},{"month":"2014-06","price":447.76,"flag":null},{"month":"2014-07","price":447.76,"flag":null},{"month":"2014-08","price":448.0,"flag":null},{"month":"2014-09","price":447.76,"flag":null},{"month":"2015-02","price":441.18,"flag":null},{"month":"2015-04","price":447.0,"flag":null},{"month":"2015-05","price":448.0,"flag":null},{"month":"2015-06","price":441.0,"flag":null},{"month":"2015-12","price":448.0,"flag":null},{"month":"2016-01","price":507.0,"flag":null},{"month":"2016-02","price":448.0,"flag":null},{"month":"2016-03","price":448.0,"flag":null},{"month":"2016-05","price":448.0,"flag":null},{"month":"2016-06","price":448.0,"flag":null},{"month":"2016-07","price":462.0,"flag":null},{"month":"2016-08","price":462.0,"flag":null},{"month":"2016-09","price":448.0,"flag":null},{"month":"2016-10","price":462.0,"flag":null},{"month":"2016-11","price":426.0,"flag":null},{"month":"2017-01","price":429.0,"flag":null},{"month":"2017-02","price":448.0,"flag":null},{"month":"2017-03","price":429.0,"flag":null},{"month":"2017-05","price":448.0,"flag":null},{"month":"2017-07","price":441.0,"flag":null},{"month":"2017-08","price":441.0,"flag":null},{"month":"2017-09","price":476.0,"flag":null},{"month":"2017-10","price":476.0,"flag":null},{"month":"2017-11","price":412.0,"flag":null},{"month":"2017-12","price":462.0,"flag":null},{"month":"2018-01","price":433.0,"flag":null},{"month":"2018-02","price":429.0,"flag":null},{"month":"2018-03","price":448.0,"flag":null},{"month":"2018-04","price":454.0,"flag":null},{"month":"2018-05","price":455.0,"flag":null},{"month":"2018-06","price":441.0,"flag":null},{"month":"2018-07","price":448.0,"flag":null},{"month":"2018-08","price":448.0,"flag":null},{"month":"2018-09","price":448.0,"flag":null},{"month":"2018-10","price":448.0,"flag":null},{"month":"2018-11","price":448.0,"flag":null},{"month":"2018-12","price":448.0,"flag":null},{"month":"2019-01","price":448.0,"flag":null},{"month":"2019-02","price":448.0,"flag":null},{"month":"2019-03","price":448.0,"flag":null},{"month":"2019-04","price":485.0,"flag":null},{"month":"2019-05","price":448.0,"flag":null},{"month":"2019-06","price":448.0,"flag":null},{"month":"2019-07","price":300.0,"flag":null},{"month":"2019-08","price":448.0,"flag":null},{"month":"2019-09","price":448.0,"flag":null},{"month":"2019-10","price":448.0,"flag":null},{"month":"2019-11","price":417.0,"flag":null},{"month":"2019-12","price":421.0,"flag":null},{"month":"2020-01","price":422.0,"flag":null},{"month":"2020-02","price":411.0,"flag":null},{"month":"2020-03","price":449.0,"flag":null},{"month":"2020-04","price":462.0,"flag":null},{"month":"2020-05","price":448.0,"flag":null},{"month":"2020-06","price":443.0,"flag":null},{"month":"2020-07","price":515.0,"flag":null},{"month":"2020-08","price":519.2,"flag":null},{"month":"2020-09","price":501.0,"flag":null},{"month":"2020-10","price":479.0,"flag":null},{"month":"2020-11","price":479.0,"flag":null},{"month":"2020-12","price":450.0,"flag":null},{"month":"2021-01","price":486.0,"flag":null},{"month":"2021-02","price":467.0,"flag":null},{"month":"2021-03","price":500.0,"flag":null},{"month":"2021-04","price":444.0,"flag":null},{"month":"2021-05","price":443.0,"flag":null},{"month":"2021-06","price":443.0,"flag":null},{"month":"2021-07","price":441.0,"flag":null},{"month":"2021-08","price":448.0,"flag":null},{"month":"2021-09","price":441.0,"flag":null},{"month":"2021-10","price":441.0,"flag":null},{"month":"2021-11","price":476.0,"flag":null},{"month":"2021-12","price":478.0,"flag":null},{"month":"2022-01","price":479.0,"flag":null},{"month":"2022-02","price":510.0,"flag":null},{"month":"2022-03","price":515.0,"flag":null},{"month":"2022-04","price":515.0,"flag":null},{"month":"2022-05","price":486.0,"flag":null},{"month":"2022-06","price":486.0,"flag":null},{"month":"2022-07","price":515.0,"flag":null},{"month":"2022-08","price":522.0,"flag":null},{"month":"2022-09","price":522.0,"flag":null},{"month":"2022-10","price":522.0,"flag":null},{"month":"2022-11","price":522.0,"flag":null},{"month":"2022-12","price":522.0,"flag":null},{"month":"2023-01","price":522.0,"flag":null},{"month":"2023-02","price":519.0,"flag":null},{"month":"2023-03","price":515.0,"flag":null},{"month":"2023-04","price":519.0,"flag":null},{"month":"2023-05","price":522.0,"flag":null},{"month":"2023-06","price":522.0,"flag":null},{"month":"2023-07","price":539.0,"flag":null},{"month":"2023-08","price":734.0,"flag":null},{"month":"2023-09","price":672.0,"flag":null},{"month":"2023-10","price":604.0,"flag":null},{"month":"2023-11","price":708.0,"flag":null},{"month":"2023-12","price":685.0,"flag":null},{"month":"2024-01","price":738.0,"flag":null},{"month":"2024-02","price":746.0,"flag":null},{"month":"2024-03","price":721.0,"flag":null},{"month":"2024-04","price":746.0,"flag":null},{"month":"2024-05","price":693.0,"flag":null},{"month":"2024-06","price":842.0,"flag":null},{"month":"2024-07","price":875.0,"flag":null},{"month":"2024-08","price":900.0,"flag":null},{"month":"2024-09","price":792.0,"flag":null},{"month":"2024-10","price":676.0,"flag":null},{"month":"2024-11","price":695.0,"flag":null},{"month":"2024-12","price":676.0,"flag":null},{"month":"2025-01","price":700.0,"flag":null},{"month":"2025-02","price":690.0,"flag":null},{"month":"2025-03","price":694.0,"flag":null},{"month":"2025-04","price":715.0,"flag":null},{"month":"2025-05","price":700.0,"flag":null},{"month":"2025-06","price":664.0,"flag":null},{"month":"2025-07","price":692.0,"flag":null},{"mo